Cómo debo configurar mi navegador para navegar por Línea Abierta;liniaObertaWSLOE

Cómo puede el cliente consultar las liquidaciones de TIR en Línea Abierta;LineaAbierta

Quiero conocer los requisitos para poder realizar un informe de seguimiento a un cliente de banca privada;HerramientasDeGestionYComerciales

Por dónde puedo consultar el número de movimiento para anular la constitución de un préstamo;PrestamosYCoberturas

Qué tipo de matriculas aseguramos;SegurCaixa

Datos que aparecen en Vista Rápida de Línea Abierta;LineaAbierta

Son revocables las ordenes de aceptacion de una OPA;Valores

De qué manera doy de baja el seguro de saldo pendiente;Tarjetas

Qué me permiten los grupos de trabajo en conecta;It

Condiciones del cuestionario de salud por teléfono en seguros de vida;Seguros

Se puede dar de baja un CaixaBankWallet;liniaObertaWSLOE

No sé cómo identificar un cliente extranjero residente para darlo de alta;Alfabetico

Por dónde puedo gestionar la formalización de una subrogación entre entidades;PrestamosYCoberturas

Cómo debo dar de alta un pacto de morosidad;ProductosDeActivo

Por qué un cliente ha podido reservar billetes en mi oficina;Extranjero

Un cargador para el TPV GPRS por dónde lo pido;Comercios

Podría saber el código BIC de una entidad bancaria;liniaObertaWSLOE

Para realizar un pago a empresas se aplican tarifas;liniaObertaWSLOE

Hay centros concretos a los que pueda matricularme o  sirve cualquier academia de idiomas;RecursosHumanos

Desde dónde se ha dado de alta una orden de impago de un cheque;ChequesYOid

Qué hago si el teclado del cajero automático está roto;Cajeros

Quiero saber si los duplicados de comunicados fiscales tienen comisión;liniaObertaWSLOE

Cuál es el tipo de interés de las liquidaciones de tarjetas;Tarjetas

Puedo hacer que un cliente se gestione las incidencias de recibos por Línea Abierta;DomiciliacionesTransferenciasPagos

Operativa para consultar la cotización de divisas;Extranjero

No puedo modificar un contrato de caja de seguridad;RecaudacionYOtrasOperaciones

Cómo se realiza la baja de la señal 225 que tiene una cuenta;Ahorro

Qué es la Cuenta BusinessBank;Ahorro

Tiene caducidad un cheque;ChequesYOid

Como puedo configurar el lector de código de barras;It

Cuáles son las características de una cuenta Family;liniaObertaWSLOE

¿Cómo se notificará a las oficinas las próximas campañas de BuildingCenter?;Buildingcenter

Extinción de líneas de avales;ProductosDeActivo

Funcionamiento del SME Initiative;PrestamosYCoberturas

Puedo tramitar un sia si no cubro el 100% del riesgo con un pasivo;ProductosDeActivo

Cuáles son las coberturas del Segurcaixa accidentes;SegurCaixa

Quiero consultar las recepciones de monedas realizadas de los clientes;Efectivo

Dónde puedo anular el cobro del impagado al cedente;FinanciacionEspecializada

Quiero saber como se da de alta el servicio de correspondencia personalizada en Línea Abierta;LineaAbierta

Necesito toda la información para dar de alta un contrato de Línea Abierta para un particular;LineaAbierta

Quiero saber las diferentes tarjetas que hay de Accionista CaixaBank;Tarjetas

Cómo puedo cambiar el idioma de un correo de Outlook;It

Procedimiento para anular la resolución de un pagaré que estaba en incidencias;ChequesYOid

Hay alguna manera para dar de baja una tarjeta por falsificación;Tarjetas

Cuándo queda incluida la póliza de vehículos en el Pack;SegurCaixa

Qué significa pagos a empresas;liniaObertaWSLOE

Como puedo consultar los intereses de un deposito a plazo;Ahorro

duplicado tarjeta adeslas plena;SegurCaixa

Cuál es la operativa para simular Previsión Profesional;SegurCaixa

Dónde veo todas mis cuentas de particular y de empresa;liniaObertaWSLOE

Por qué me cuenta la baja en el seguimiento negocio y a otra oficina le cuenta el alta;HerramientasDeGestionYComerciales

He recibido una ejecución de un aval internacional y no se que debo hacer;Extranjero

Cómo puedo dar de alta una domiciliación del segundo plazo de la renta;MinisterioDeHacienda

Cómo puedo retroceder un donativo realizado a una ONG;HerramientasDeGestionYComerciales

Pasar dinero de la mi tarjeta a mi cuenta tiene coste;liniaObertaWSLOE

Qué debo hacer para poner gastos en un contrato en morosidad;ProductosDeActivo

Los plazos de retrocesión automática de una operación pendiente de confirmar sabemos cuáles son;Tarjetas

Hay forma de saber qué comercios pueden disponer del servicio Taxfree;Comercios

Por dónde puedo condonar la comisión de mantenimiento de una cuenta en divisas;Extranjero

Dónde se encuentra la información del bloqueo Cautelar de una tarjeta por Incumplimiento ley 10/2010;Tarjetas

Tengo una OID en incidencias y no veo la documentación para poder resolverla;ChequesYOid

como veo las ampliaciones de capital en curso o anunciadas;Valores

que hacemos para cancelar una cartera de fondos;FondosDeInversion

No sé cómo pagar un premio de lotería nacional;RecaudacionYOtrasOperaciones

De qué manera actúo si no han llegado las tarjetas en Stock;Tarjetas

Tenemos unos billetes nuevos para hacer el pago de los viajes del IMSERSO;DomiciliacionesTransferenciasPagos

He pedido un extracto de ahorro a la vista pero ya no lo quiero;Ahorro

No puedo hacer un traspaso de clientes  ya que me sale un aviso  no se puede hacer el cambio de gestor;HerramientasDeGestionYComerciales

Cuáles son las características de la tarjeta Pensión MultiEstrella;Tarjetas

Con qué siglas se identifica cada cartera;HerramientasDeGestionYComerciales

Es posible informar de un siniestro en un seguro de industria;SegurCaixa

Cómo realizo un traspaso externo al tándem Premium;PlanesDePensiones

Cómo puedo consultar el estado de un pedido;ArchivoMttoYSuministros

Cómo consulto la caducidad de la Cybertarjeta;liniaObertaWSLOE

Puedo seleccionar una impresora láser desde el terminal financiero;It

Cómo hacemos un cheque bancario para que lo cobren en el extranjero;ChequesYOid

todo sobre plan de pensiones;PlanesDePensiones

Cómo puedo cambiar el depósito de abono de una pensión de Seguridad Social;RecaudacionYOtrasOperaciones

El cliente debe tener un modelo de relación concreto para disponer de muro;HerramientasDeGestionYComerciales

A mi cliente le han cobrado una comisión de reclamación de impagados Cuál es el motivo;FinanciacionEspecializada

Necesito pagar unas participaciones de Navidad que pone que se pueden pagar en CaixaBank;RecaudacionYOtrasOperaciones

Por qué opción de Línea Abierta se puede hacer una suscripción;LineaAbierta

telefono asistencia segurcaixa auto;SegurCaixa

Cómo ingreso el sobrante de billetes una vez localizada la anomalía en la entrega de billetes de un cajero;Cajeros

Es posible modificar el orden de todos titulares de una cuenta;Alfabetico

Procedimiento de cesión de documentos de valor;Efectivo

De qué forma tengo que pedir un CaixaPin;LineaAbierta

Cómo consulto un cheque;liniaObertaWSLOE

Cómo se los vh que no puedo asegurar en SCA;SegurCaixa

Voy a cambiarme de domicilio, ¿cómo tengo que solicitar el permiso por traslado de domicilio?;RecursosHumanos

Como modificamos los permisos de una libreta;Ahorro

como dar de alta una transferencia nacional periodica?;DomiciliacionesTransferenciasPagos

Al dar de alta un cliente en BC el teléfono me sale asignado a otro cliente puedo modificarlo;Buildingcenter

Cuando puedo anular un regalo;Marketing

Necesito quitar un atasco de la entrada del rollo superior de papel de la unidad de documentos térmica;Cajeros

Necesito desactivar el CaixaPIN y volver a la tarjeta de coordenadas;liniaObertaWSLOE

Cómo puedo saber las modalidades de tarjetas Stock que hay;Tarjetas

Cuál es la operativa para anular un ingreso o reintegro contable de una cuenta en divisas;Extranjero

Por dónde pido un TPV Tablet;Comercios

Preguntas frecuentes sobre datos mensuales y comercial de IGC;HerramientasDeGestionYComerciales

Por dónde tramito un siniestro de vida del banco Valencia;Seguros

autorizar familiar vendedor para entrega paquete ONCE;RecaudacionYOtrasOperaciones

Alta nueva familia en una GLI;CreditoLeasingRentingRiesgo

Qué productos entran en la campaña de la tv;SegurCaixa

Necesito localizar la información del carné joven de la Comunidad de Madrid;Tarjetas

Procedimiento para añadir a nuevos usuarios en un contrato de Línea Abierta;LineaAbierta

Cómo damos de alta un contrato de truncadora;ChequesYOid

En compra estrella dónde consulto el derecho de desestimiento;Marketing

Quiero saber en qué consiste y para qué sirve la app CaixaBank Sign;LineaAbierta

Cuando se realiza la baja de una orden de un fichero de PAG Cuándo se le abona al ordenante;DomiciliacionesTransferenciasPagos

Que servicios de móviles ofrece CaixaBank;LineaAbierta

Al operar con el reciclador aparece error en aplicación de gestión del dispensador;DispensadoresYRecicladores

¿como puedo pagar un número de loteria del estado?;RecaudacionYOtrasOperaciones

Por qué no puede un comercio CaixaBank aceptar tarjetas American Express;Comercios

Quiero saber los requisitos para comprar con NFC;Tarjetas

Por qué no me aparece un recibo para añadir a Recibo Único;DomiciliacionesTransferenciasPagos

Tengo un aplazamiento de Hacienda en incidencias por NIF no titular del contrato;MinisterioDeHacienda

Cómo consultar un pacto de descuentos de un comercio;Comercios

Las transferencias emitidas por ficheros de PAG se pueden consultar;DomiciliacionesTransferenciasPagos

Como consulto el estado logístico de una solicitud de compra estrella;Marketing

Puede solicitar donaciones de la Obra Social un particular;ArchivoMttoYSuministros

Qué debo hacer para saber quién es el beneficiario en un seguro de ahorro;Seguros

Denuncias pro robo de efectivo;ArchivoMttoYSuministros

Cómo le puedo cambiar un nombre a un terminal;ArqueoYContabilidad

Cómo se pueden hacer las entregas de capital en un préstamo de Autopromotor;PrestamosYCoberturas

Consultas de la libreta Campeones;Seguros

¿Por qué da error al imprimir un contrato de Línea Abierta ImaginBank?;LineaAbierta

De qué forma puedo comprobar si el comercio tiene de un número de comercio en el FUC;Comercios

Qué características tiene la señal 215 de NIF extraviado;Alfabetico

Cómo podemos hacer un cambio de divisa en un préstamo y mirar el tipo que aplicará;PrestamosYCoberturas

Por qué motivo queda retenido el abono de una Orden de Traspaso de Efectivo OTF;DomiciliacionesTransferenciasPagos

Información para la modificación de la fecha valor de una transferencia internacional emitida;TransferenciasAlExtranjero

Quiero conocer el porcentaje de atención a medida de los clientes de banca premier Cómo lo hago;HerramientasDeGestionYComerciales

Cómo saber los límites en la operativa de transferencias;liniaObertaWSLOE

¿Dónde localizo información sobre un embargo de fondos?;FondosDeInversion

Dónde se informa que un cliente ha perdido su NIF;Alfabetico

Qué relaciones están permitidas en una cuenta de una comunidad de bienes;Alfabetico

Cómo solicito el alta de un CaixaWallet;liniaObertaWSLOE

No sé como recepcionar moneda encartuchada de clientes;Efectivo

Anular factura de gastos de empleado;ArchivoMttoYSuministros

Cómo puedo entrar un pacto para las comisiones de una remesa electrónica de exportación;Extranjero

Necesito saber qué información tengo en la vista evolución de ventas en AVE;HerramientasDeGestionYComerciales

Operativa para contratar una póliza de decesos completo;SegurCaixa

Cómo activar en cajeros la operativa guiada con lenguaje de signos;Cajeros

Cómo obtener un extracto de la cuenta en formato excel;liniaObertaWSLOE

Cómo puedo contratar el seguro SegurCaixa Electrodomésticos;SegurCaixa

Cómo ver el facsimil de moneda extranjera;Efectivo

TPVs Toda la información;Comercios

Quiero contratar el seguro de saldo pendiente para las tarjetas;liniaObertaWSLOE

Cómo puedo controlar la moneda que me entregan los clientes;Efectivo

Por qué no puedo registrar más huellas con mi usuario;It

Cómo bajar la prima de un auto que está en pack;SegurCaixa

Poner tarjeta en Apple Pay desde CaixaBank Pay;Tarjetas

¿Cómo puedo reeditar el contrato de una cuenta Imaginbank?;Ahorro

Cómo puede el cliente localizar su cartera gestionada de fondos en Línea Abierta;LineaAbierta

Características de la Renta Vitalicia diferida;Seguros

Cómo consulto el catálogo de TPVs;Comercios

Por qué no tengo opción en el SIA de constituir una línea de leasing;CreditoLeasingRentingRiesgo

Necesito eliminar contactos de forma masiva por el Asesor de ventas;HerramientasDeGestionYComerciales

Cómo puedo contratar el seguro SegurCaixa MovilProtect;SegurCaixa

No sé qué tipos de documentos se pueden para la realización de un expediente de TES;ServiciosJuridicos

Quién puede llamar al teléfono de Caixagiros para reclamar que no se ha recibido en destino;TransferenciasAlExtranjero

Solicitud duplicado carnet empleado;RecursosHumanos

Cómo puedo capturar el NIF desde la APP del dispositivo móvil;It

Qué importes se reciben por ser Apoderado de Equipos de Suplencia;RecursosHumanos

En el Portal hay inmuebles no comercializables pero se indica que puede hacerse arras por qué;Buildingcenter

Condiciones económicas de los microcréditos sociales;PrestamosYCoberturas

Error en la constitución de una ccr;CreditoLeasingRentingRiesgo

Por dónde consultar una orden de impago que tiene un cheque;ChequesYOid

Cómo tramito la devolución de un modelo 806 de fianza de alquiler de la Generalitat de Valencia;RecaudacionYOtrasOperaciones

Disposiciones vencidas y no vencidas de un Crédito Stock;CreditoLeasingRentingRiesgo

Qué debo hacer cambiar los Kg asegurados en la póliza complementaria;Seguros

Propiedades del VidaCaixa Negocios y Empresas;Seguros

Dónde se encuentra la información de las características de la tarjeta Regalo;TarjetasDePrepago

Puedo reclamar varios movimientos por un motivo determinado;Tarjetas

No puedo dar de alta una firma porque me da error 0401 código de barras no encontrado;It

Puedo ceder un billete extranjero falso que me entrega el cliente;Efectivo

Consultas de la Renta Vitalicia Inversión Deuda Pública;Seguros

Cómo se puede dar de alta una orden de transferencia periódica a un cuenta internacional;liniaObertaWSLOE

Cómo consigo gestionar un BLIP de la compañía Barclays Vida y Pensiones;Seguros

Cómo saco el comunicado fiscal de un pago de premio de la lotería nacional;RecaudacionYOtrasOperaciones

Que tengo que hacer para tramitar la cartera BPO;HerramientasDeGestionYComerciales

Necesito información sobre los pagos móvil a móvil inmediatos;LineaAbierta

Cómo accedo al alimentador del reciclador GETRONICS CM-14;DispensadoresYRecicladores

Por dónde encuentro el cumplimiento de las promociones de VidaCaixa;PlanesDePensiones

Cómo puedo cancelar una póliza de SegurCaixa Accidentes Rentas;SegurCaixa

No sé cómo se calcula el dígito de control de una tarjeta ingresos 24 horas;Tarjetas

Puedo aceptar cualquier moneda euro;Efectivo

Qué es la campaña Bein sport;SegurCaixa

Cambio de los consumibles de la impresora láser RICOH 4510;ArchivoMttoYSuministros

Cómo puedo consultar las partidas pendientes de la oficina;ArqueoYContabilidad

Por dónde se modifica la renta financiera de un plan por Línea abierta;PlanesDePensiones

Es posible modificar una reunión ya generada;It

Quiero retroceder un pago domiciliado de seguridad social;RecaudacionYOtrasOperaciones

Qué utilidad tiene Ahorra el Cambio;liniaObertaWSLOE

Cual es la ruta para imprimir la entrada a cosmocaixa;Marketing

Necesito acceder al portal de fondos;FondosDeInversion

El cliente ha perdido la libreta pero no puede venir él a realizar los trámites;Ahorro

La información que da la ficha del inmueble no se ajusta a la real;Buildingcenter

Qué debo hacer para que no se bloquee la contraseña del correo de Outlook de mi móvil;It

Motivos por los que no se recibe la clave OTPSMS en el móvil al operar por Línea Abierta;LineaAbierta

porque los recibos se cobran fuera del recíbo único;DomiciliacionesTransferenciasPagos

Renovación Carné Club Super3;Marketing

Se pueden vender valores internacionales;Valores

Operativa de terminal TOC para la gestión de los ingresos;Cajeros

Cómo consultar el límite asignado a un ordenante de TIR;DomiciliacionesTransferenciasPagos

Qué significa número de carpeta;liniaObertaWSLOE

Cómo se constituye una subrogación entre entidades;PrestamosYCoberturas

Cómo puedo consultar los comunicados trimestrales que recibe un cliente sobre su posición en estructurados;Ahorro

Por dónde accedo a la información del servicio DevoluIva para un comercio;Comercios

Quiero imprimir un folleto digital en el idioma del cliente;Marketing

Qué requisitos hay para que el cliente pueda crear plantillas de TIR en Línea Abierta;LineaAbierta

Cómo dar de alta un cedente de gestión de cobro de efectos;FinanciacionEspecializada

Desconozco como se aprueban las facturas de gastos de empleado;ArchivoMttoYSuministros

Cual es el funcionamiento del nuevo criterio de calculo de la condonación;HerramientasDeGestionYComerciales

Por qué tengo retenido el abono de una Orden de traspaso de efectivo OTF que dio de alta mi cliente;DomiciliacionesTransferenciasPagos

Necesito compartir el escritorio en una reunión de Lync;It

No sé como localizar la información de las bonificaciones de Mollet;Tarjetas

Cómo se contabilizan los gastos de empleado;ArchivoMttoYSuministros

Cómo se puede anular una remesa de efectivo;Efectivo

Necesito consultar los nuevos inmuebles de Building;Buildingcenter

Es posible reimprimir el justificante de adquisición de un articulo;Marketing

Por donde accedo para resolver dudas de estados logísticos en compra estrella;Marketing

Una operación de tarjetas me puede generar descubierto en la cuenta;Tarjetas

Necesito saber cual es el orden de entrada de los datos en el seguimiento campaña;HerramientasDeGestionYComerciales

Cómo puedo saber que operativa puede gestionar el comercio por el Cyberpac;Comercios

Cómo puedo saber el funcionamiento de una cuenta de ahorro pignorada;ProductosDeActivo

5% de la nómina cuando se abona al clientes?;Marketing

corregir una solicitud de cambio de titularidad;Valores

Cómo solicito un traspaso externo al tándem Premium;PlanesDePensiones

Cómo hacemos para que al cliente se le envíen justificantes de las transferencias que se emiten por PAG;DomiciliacionesTransferenciasPagos

¿Por dónde puedo variar datos en un efecto de cartera?;FinanciacionEspecializada

Cómo puedo anular el pago de un NRC;liniaObertaWSLOE

Dónde encuentro la operativa para abonar una transferencia internacional;TransferenciasAlExtranjero

Cuáles son las condiciones para rescatar un seguro de ahorro procedente de CajaSol;Seguros

Qué debo hacer para aprobar las facturas tramitadas en la oficina;ArchivoMttoYSuministros

Cuál es la operativa en el cajero para pagar un impuesto con código de barras;Cajeros

Cómo compruebo las conexiones si Vodafone me aparece limitado en la tablet;It

Defunciones en ahorro vista;Ahorro

Existe algún manual del servicio de Carta cheque o pagaré de PAG;DomiciliacionesTransferenciasPagos

Qué información hay de la Tarifa TPV Negocios Captación 2016;Comercios

La cuenta con la que resuelvo el COP esta candelada;ArqueoYContabilidad

Cómo puede ver el cliente en Línea Abierta las liquidaciones del TIR;LineaAbierta

Cómo podemos ampliar el seguro de una caja de alquiler;RecaudacionYOtrasOperaciones

Cómo puedo realizar la cancelación notarial de un préstamo que tiene varias garantías;PrestamosYCoberturas

Cuándo se da de baja el riesgo de los efectos de cartera para tener la línea disponible;FinanciacionEspecializada

Dónde pido el descuento de la alarma en la póliza de hogar;SegurCaixa

Cómo rellenar la EPC si hay personas interpuestas;Alfabetico

¿Como acepto/rechazo la cesión de una comisión/incentivo?;Buildingcenter

Cómo se hace entrada manual sin totales ARE;ArqueoYContabilidad

Quiero pagar el bastidor sin financiación de Caixabank;CreditoLeasingRentingRiesgo

No sé que hacer una vez nos han enviado el resultado de un bastanteo;ServiciosJuridicos

Cuál es la ruta para bajar el importe del aviso de ReciBox Recibo pagado superior a un importe;LineaAbierta

Cómo recupero una simulación de furgoneta;SegurCaixa

Cómo debo informar la fecha de matriculación del auto;SegurCaixa

Cómo sé en qué sitios puedo operar sin contacto;liniaObertaWSLOE

Cómo imprimo un comunicado fiscal por cajero;Cajeros

Qué movimiento selecciono en el diario de operaciones para anular la transferencia Internacional;TransferenciasAlExtranjero

Quién puede hacer una modificación masiva de matrículas;It

Cuales son los sitios de recogida de leche;ArchivoMttoYSuministros

Qué hago si a un cliente de banca premier no tiene todos los contratos en el expediente;HerramientasDeGestionYComerciales

Por dónde resuelvo un error alfabético que me ha dado en el alta de contrato de tarjetas;Tarjetas

Cuál es el procedimiento para renovar el límite de un contrato de Ordenante de TIR;DomiciliacionesTransferenciasPagos

Quiero saber cómo pagar a Telefónica móviles Movistar sin tener sin tener número de cuenta ni carta de pago;Cajeros

Qué cubre el Vida Familiar;Seguros

Qué hago para asignarle una TLO de nuevo a un cliente con CaixaBank Sign activado;LineaAbierta

No sé qué es el contactless;liniaObertaWSLOE

Al devolver una transferencia emitida ha quedado en incidencias Cómo se gestiona;DomiciliacionesTransferenciasPagos

Iniciar una remesa de incidencias de seguros sociales de cargos	;RecaudacionYOtrasOperaciones

Cliente quiere un CaixaBankWallet;LineaAbierta

Un contrato de Recibo Único se dio de baja y ahora el cliente lo quiere reactivar;DomiciliacionesTransferenciasPagos

Como hago para acceder al portal de fondos ahora;FondosDeInversion

necesitamos ayuda para el cuadre de efectivo;ArqueoYContabilidad

Información acerca del porcentaje de atención a medida de los clientes de banca premier;HerramientasDeGestionYComerciales

Procedimiento para anular una asignación de CaixaPin;LineaAbierta

Cómo puedo realizar la anulación del modelo 696 de la AEAT;MinisterioDeHacienda

¿Qué clientes pueden realizar el KYC en Línea Abierta?;LineaAbierta

Quiero gestionar una póliza de auto migrada;SegurCaixa

Es posible cobrar la prestación en forma de renta;PlanesDePensiones

Cómo resuelvo un contrato de Línea Abierta con Identificadores duplicados;LineaAbierta

Quiero gestionar una cita previa de un cliente  cómo lo hago;HerramientasDeGestionYComerciales

Quiero consultar la información del servicio CaixaBank Pay;Tarjetas

como se da de baja una senal en fondos de inversion;FondosDeInversion

Se puede contratar a todo riesgo sin franquicia un turismo de segunda mano;SegurCaixa

No encuentro un inmueble que tiene el cartel de Servihabitat para la venta;Buildingcenter

Se ha devuelto un recibo y no lo hemos visto en las incidencias de oficina;DomiciliacionesTransferenciasPagos

Quiero dar de alta un producto ahorro vista que no sea Libreta estrella;Ahorro

El director puede restaurarme la contraseña;It

Documento en el RAI Cómo hago la baja;ProductosDeActivo

Como solicito un certificado de la posición de valores de hace tiempo;Valores

Qué hago para comprobar la vinculación financiera de los criterios de acceso de las Tarifas Bonificadas;Comercios

Cómo accedo a la consulta sinco si el cliente tiene 5 pólizas;SegurCaixa

Características del Segurcaixa accidentes premium;SegurCaixa

Quiero que me recuperen el dinero que me queda disponible en la cybertarjeta;liniaObertaWSLOE

Ejecución de un aval internacional;Extranjero

En la vista evolución de ventas en AVE qué información tengo;HerramientasDeGestionYComerciales

Qué es la garantía eficaz;ProductosDeActivo

Por el TPV que comisión se cobra;Comercios

Tengo que ceder moneda suelta a la compañía;Efectivo

Quiero teclear el concepto de una transferencia a Jordania;TransferenciasAlExtranjero

error en recepcion de divisas;Extranjero

Firma de operaciones por Línea Abierta;LineaAbierta

Cuáles son los pasos a seguir para pedir los juguetes de Reyes;ArchivoMttoYSuministros

Por donde modifico el interlocutor de un grupo de banca premier;HerramientasDeGestionYComerciales

Que pasos he de seguir para informar el cambio de combinación del cajero;Cajeros

¿Cómo puede una empresa acceder a ReciBox?;LineaAbierta

¿Cuál es el último día de periodo voluntario de un modelo de la AEAT?;MinisterioDeHacienda

Por dónde puedo ver toda la información del Servicio Organismos Oficiales;Comercios

Quiero saber si un cliente dispone de  Cyberpac no seguro;Comercios

Mensaje Porcentaje elevado de efectos impagados / reclamados al entrar una remesa de cartera;FinanciacionEspecializada

Es posible contratar una Línea Abierta a un menor;LineaAbierta

¿Se puede hacer un donativo con Bizum?;LineaAbierta

Como puedo escanear documentos desde un expediente electrónico;It

He pagado un impuesto y quiero saber cómo obtener un justificante;liniaObertaWSLOE

Cómo se hace una amortización anticipada de un préstamo en divisas;PrestamosYCoberturas

