Es necesario PIN para las compras con la tarjeta regalo MultiSeguros;TarjetasDePrepago

Cómo realizo una petición para un informe de solvencia;ProductosDeActivo

Cuánto dinero puedo usar con el disponible Family;liniaObertaWSLOE

Necesito revisar el cajetín de rechazados de la unidad de reintegros cajero Punt Groc;Cajeros

Cómo solicito el permiso por cumplimiento de un deber inexcusable;RecursosHumanos

Qué debo hacer para modificar una póliza de mascotas;SegurCaixa

Cómo localizo el descuadre contable;ArqueoYContabilidad

Qué debo hacer si tengo un atasco en el transporte de salida de los cajetines de la unidad de reintegros cajero Punt Groc;Cajeros

Cómo resuelvo una pensión en incidencias;RecaudacionYOtrasOperaciones

Por dónde informo de una avería de TPV;Comercios

Cómo aumento el límite de las disposiciones de efectivo en cajeros;liniaObertaWSLOE

SGC Alta de pacto por cliente;HerramientasDeGestionYComerciales

Cuál es la operativa para consultar que comisiones tienen las remesas de exportación;Extranjero

Cuál es la documentación que debo presentar para solicitar la desvinculación del 2017;RecursosHumanos

Cómo puedo modificar los datos de un proveedor de gastos del centro;ArchivoMttoYSuministros

Qué tipo de cambio se aplica en el préstamo de divisas;PrestamosYCoberturas

No localizo mi libreta y no sé que tengo que hacer;liniaObertaWSLOE

Cuáles son los seguros que puedo meter en un pack pymes;SegurCaixa

Cómo realizo la validación de la siniestralidad a un cliente no target en auto;SegurCaixa

Quiero hacer una donacion  a una ONG;HerramientasDeGestionYComerciales

Dónde encuentro la operativa para consulta de remesas de importación;Extranjero

Qué debo hacer para retener una póliza de salud;SegurCaixa

Por dónde anulo una transferencia;liniaObertaWSLOE

Cuánto tarda en recibirse la autorización para el pago de un cupón de la ONCE;RecaudacionYOtrasOperaciones

Dónde hay información sobre la campaña de la paga en Rentas Vitalicias;Seguros

Se pueden ver en el Portal los inmuebles de los que aún no tenemos la posesión;Buildingcenter

Se puede anular un cobro del IMSERSO pagado en días anteriores;DomiciliacionesTransferenciasPagos

Por dónde se amortiza un préstamo en divisas;PrestamosYCoberturas

Deseo saber qué es STP en una transferencia internacional;liniaObertaWSLOE

Qué periodo muestra el formulario de Compensación Total;RecursosHumanos

No tengo signos de puntuación en el Smartphone;Telefonia

Cuál es la operativa para ver las operaciones de un comercio;Comercios

Cómo avanzo el pago de la tarjeta de crédito;liniaObertaWSLOE

Dónde se encuentra la información de los descuentos de comercios;Comercios

Información de la promoción de incentivos por venta de seguros de vida;Seguros

Qué hacer si al teclear ccs me solicita nivel 4;Marketing

Cuándo se presenta el modelo 347;Valores

Cuánto cuesta sacar dinero de cajero en el extranjero;liniaObertaWSLOE

¿Cuál es la operativa para revocar un traspaso en un plan?;PlanesDePensiones

Qué importe me corresponde para libros en las ayudas universidad pública;RecursosHumanos

Cómo accedo la operativa SGL;It

Por dónde solicito los diferentes soportes de Vía T;Tarjetas

Cómo puede un comercio con más de un tpv tener un abono en cuenta por TPV;Comercios

¿Qué hace falta para ver planes de pensiones en Línea Abierta ?;LineaAbierta

Por donde modifico las condiciones de multifirma en Línea Abierta;LineaAbierta

Cuál es la operativa para realizar la compra de billetes a un cliente y que comisiones se aplican;Extranjero

Cómo consulto la composición en un seguro de inversión;Seguros

Se puede ver si la póliza de auto está incluida en pack;SegurCaixa

gasto empleado vehiculo propio;ArchivoMttoYSuministros

Tengo una factura en fac pendiente de abono ;ArchivoMttoYSuministros

R2B para aportaciones en Planes de pensiones EPSVS y PPAS;PlanesDePensiones

Como consulto los regalos de la campaña nomina Family 2018;Marketing

Por dónde puedo retroceder una operación con tarjeta;Tarjetas

Familias de las líneas de avales;ProductosDeActivo

Que día es el del espectador en el club ahora;Marketing

Cómo gestionamos un oficio de un juzgado;RecaudacionYOtrasOperaciones

Cuáles son los productos que entran en la promoción de aportaciones a Planes de Pensiones a titulares Obligación Subordinada;PlanesDePensiones

Por dónde cancelo una transferencia;liniaObertaWSLOE

Cuál es la comisión que se aplica por la compra de billetes en una cuenta de la misma divisa;Extranjero

Necesito ver las denegaciones de una tarjeta y No sé por dónde;Tarjetas

Petición de etiqueta de cajeros más próximos;ArchivoMttoYSuministros

Para dar de baja los títulos extranjeros   que hay que hacer;Valores

Cuál es la forma de gestionar una solicitud de identificación a titulares de tarjetas DisaShop;TarjetasDePrepago

Cómo se cancela un pago a terceros;RecaudacionYOtrasOperaciones

Qué hacer con un cheque que ha quedado en incidencias por error en el vencimiento;ChequesYOid

Cómo puedo solicitar un articulo por CCS;Marketing

Cómo consulto las normas básicas de carterización en BPR/BPE;HerramientasDeGestionYComerciales

Se puede aperturar una cuenta en divisas a un no residente;Extranjero

Por dónde solicito el certifico de empresa para tramitar la maternidad;RecursosHumanos

Cómo se solicita la Oferta Vinculante;Tarjetas

Me explicas el phising;liniaObertaWSLOE

Necesito saber si en compras con las tarjetas regalo MultiSeguros se requiere PIN;TarjetasDePrepago

Como obtengo mas de un estuche top Secret;Marketing

Cómo se qué ocurre cuando mi cliente tiene un impagado en la tarjeta de crédito mensual con domiciliación ajena;Tarjetas

El tiempo de respuesta de la restauración de mis credenciales es siempre el mismo;It

Cuándo se realizan los servicios de efectivo en días festivos;Efectivo

Cómo se abona una transferencia pendiente hasta fecha valor;TransferenciasAlExtranjero

Cómo entrego un articulo que tengo en la oficina a cambio de un vale;Marketing

quiero reclamar una operacion de tarjeta;Tarjetas

He perdido el original de los poderes,  ¿cómo pido una nueva copia?;RecursosHumanos

Cómo puedo saber el funcionamiento de un fondo de inversión si está retenido por pignoración;ProductosDeActivo

Por dónde anulo un accidentes empresas;SegurCaixa

Que modelo de escaners pueden digitalizar firmas;It

quiero hacer una orden de compra combinada ;Valores

Tengo problemas con la clave del AGS;ArchivoMttoYSuministros

Hay información del Argumentario Cero quejas de tarjetas;Tarjetas

Por dónde puede ver el cliente sus contratos firmados en Línea Abierta;LineaAbierta

Cómo puedes pagar un impuesto a la Agencia Tributaria;liniaObertaWSLOE

 Necesito saber que es la Venta Segura;Extranjero

Se puede pedir una Cybertarjeta;TarjetasDePrepago

Qué persona se encarga de realizar la designación de beneficiarios del Plan de empleo;RecursosHumanos

Cómo puedo contratar Mi Hucha;liniaObertaWSLOE

Tengo el CaixaWallet caducado;liniaObertaWSLOE

Cómo se accede al Programa Family en Línea Abierta;LineaAbierta

orden de suscripcion de acciones que vienen de un SCRIP dividend;Valores

Cuándo se asigna incentivo por la venta de un inmueble de BuildingCenter;Buildingcenter

Cómo se procede si el alquiler se pago por una transferencia normal en lugar de hacerlo por la orden periódica;DomiciliacionesTransferenciasPagos

Tengo que anular un NRC de hacienda que pasamos mal por error nuestro pero antes de ayer finalizó el periodo voluntario;MinisterioDeHacienda

Dónde consigo los justificantes de los pagos de impuestos que he realizado;liniaObertaWSLOE

Necesito saber qué características tiene mi Hucha en Línea Abierta;LineaAbierta

Cómo se ve la dirección la dirección IP de acceso a Línea Abierta;LineaAbierta

Con mi tarjeta puedo traspasar el crédito a mi cuenta;liniaObertaWSLOE

Quiero saber cómo se da de alta un ordenante de Hacienda;MinisterioDeHacienda

Tengo que enviar yo el sobre resumen anual de un impuesto de Hacienda;MinisterioDeHacienda

Por dónde puedo realizar una compra o venta de billetes con una cuenta en divisas;Extranjero

¿Cómo puedo modificar la forma de pago de un pedido de Compra Estrella?;Marketing

Podría saber que es el número de carpeta;liniaObertaWSLOE

Se me ha roto el carnet de empleado cómo pido una copia;RecursosHumanos

Se puede formalizar un SIA  por Ready to Buy;PrestamosYCoberturas

Cómo modificar el límite y las retenciones de un ordenante de recibos TIR;DomiciliacionesTransferenciasPagos

Desde dónde se pide el traslado del escáner;It

Hay forma de dar de baja un comercio;Comercios

Cual es la ruta para pedir un cambio de ubicación de un escáner;It

Quiero cambiar el móvil de CaixaBankProtect;Tarjetas

Cuál es la operativa para cancelar un seguro del móvil;SegurCaixa

Cómo puedo cambiar la cuenta de mi pensión;liniaObertaWSLOE

Pantallas para declarar un siniestro de agrario;Seguros

Consulta de facturas de gastos de empleado;ArchivoMttoYSuministros

Por qué no puedo realizar una cancelación notarial;PrestamosYCoberturas

Información del VidaCaixa Inversión Mixto convertible 24;Seguros

Qué hago para borrar el Contactless de las tarjetas de CaixaBank;Tarjetas

Quién recibe el incentivo de la venta de un inmueble de BuildingCenter;Buildingcenter

Quiero saber qué es ReciBox y qué clientes pueden tenerlo;LineaAbierta

Qué hago sino funciona el lector de tarjetas;It

Consultar IMEI de móvil;Marketing

Opciones de pago de leasing;CreditoLeasingRentingRiesgo

como contratar una renta vitalicia;Seguros

Propiedades del VidaCaixa Inversión Mixto convertible 22;Seguros

Qué condiciones debe tener el préstamo del cliente para realizar una subrogación entre entidades;PrestamosYCoberturas

Quién puede contratar una tarjeta regalo;liniaObertaWSLOE

Dónde puedo indicar las preferencias de mi cliente para alquilar de un inmueble de BC;Buildingcenter

Quiero saber cómo resolver una prestación del desempleo en incidencias;RecaudacionYOtrasOperaciones

Cuál es el procedimiento para modificar una Orden de traspaso puntual emitida;DomiciliacionesTransferenciasPagos

Cómo debo resolver los apunte de embargos que hay en el COP;ArqueoYContabilidad

Dónde veo cómo contratar una tarjeta de crédito;Tarjetas

Quiero dar de alta un proveedor de confirming con datos mínimos;Alfabetico

Podemos consultar los estados que puede tener un expediente de defunción;Alfabetico

Cuánto le cobran a mi cliente por el servicio DevoluIva;Tarjetas

En la Tarjeta Club Ahora se incluye la Tarjeta Dorada de RENFE;Tarjetas

Al hacer el ingreso de un cheque queremos marcar que se proteste en caso de impago;ChequesYOid

Cuál es la operativa si el comercio pierde las claves de acceso del Cyberpac;Comercios

Tengo billetes atascados en la parte superior del dispensador GETRONIC CM-24;DispensadoresYRecicladores

Cómo puedo cambiar la cuenta vinculada a mi tarjeta;liniaObertaWSLOE

Solicité un cambio de pensión de otra entidad y quiero ver en qué estado se encuentra;RecaudacionYOtrasOperaciones

Cómo se gestiona el servicio de limitación de operativas de tarjetas por Línea Abierta;LineaAbierta

SI el cliente no tiene riesgo en Caixa también se declara en CIRBE;ProductosDeActivo

Cuál es el importe máximo que puede dispensar un cajero en un reintegro;Cajeros

Por dónde se pagan los timbres de un documento ingresado en días anteriores;ChequesYOid

Necesito saber qué clientes pueden ver Mis Finanzas;LineaAbierta

Se ha estropeado mi tarjeta y estoy en el extranjero;liniaObertaWSLOE

Qué características puede tener un billete falso;Efectivo

Tengo un cliente que quiere operar con Valores en su Línea Abierta y no sabemos qué límite se aplica;LineaAbierta

Cómo localizar los errores de un fichero de recarga de tarjetas prepago enviado por Línea Abierta que no se ha procesado;LineaAbierta

Cómo puedes activar el acceso a Línea Abierta con certificado digital;liniaObertaWSLOE

Tengo atasco en el identificador de billetes del reciclador;DispensadoresYRecicladores

Nueva Línea Abierta en Facebook;LineaAbierta

Puedo demandar diferentes soportes de Vía T;Tarjetas

Por qué no se visualizan las cuentas de un cliente en Línea Abierta;LineaAbierta

Quiero el terminal financiero en catalán;It

Tengo que hacer una solicitud de compra estrella qué campos debo cumplimentar;Marketing

Cuáles son las tarjetas destinadas para los jóvenes;Tarjetas

Cuál es el procedimiento a seguir si un cliente extravía un cheque de su cuenta corriente;ChequesYOid

Cómo obtengo volantes de empadronamiento y certificados de residencia de las islas Baleares por el cajero;Cajeros

Cuál es la operativa de Línea Abierta para solicitar ficheros de comunicados;LineaAbierta

Qué opción existe para localizar un banco extranjero para enviar una transferencia internacional;TransferenciasAlExtranjero

Qué pasos tengo que seguir para pagar un impuesto de la AEAT por Línea Abierta;liniaObertaWSLOE

Qué debo hacer si tengo un atasco en la unidad de libretas de mi cajero F80XX y Punt Groc con numeración inferior a 16100;Cajeros

¿Cómo se inicia una transferencia nacional de abono inmediato?;DomiciliacionesTransferenciasPagos

¿por que me pide un documento al recargar la cybertarjeta?;Tarjetas

"¿Cómo desactivar la notificación de ""Aviso de uso de datos"" en Smartphone Samsung?";Telefonia

Cuál es la navegación de Línea Abierta para obtener duplicados de comunicados fiscales de un particular;LineaAbierta

Quiero un CaixaPIN;liniaObertaWSLOE

Escanear simultáneamente desde la impresora HP 3035;It

Necesito saber qué consultas puede hacer el cliente en Mis Finanzas;LineaAbierta

Cómo crear en Línea Abierta facturaciones de recibos online;LineaAbierta

No sé anular ppads;ArqueoYContabilidad

Cuáles son los pasos a seguir para que un cliente pueda ingresar cheques por Línea Abierta;LineaAbierta

Cómo sé si una emisora de recibos indomiciliados admite el pago con cheque de un impuesto;RecaudacionYOtrasOperaciones

Quiero verificar que los periféricos funcionan correctamente en terminal W7;It

Qué partes del cajero debo revisar si tengo una libreta atascada en el cajero Punt Groc Fujitsu;Cajeros

Por dónde puedo ver toda la información de comercios;Comercios

Cómo se puede solicitar Expediente Hipotecario de archivo procedente de Barclays;ArchivoMttoYSuministros

Puedo comprar o vender un billete que no aparece en el facsímil;Extranjero

Reducción de jornada por cuidado de familiar grave;RecursosHumanos

dar de baja seguro del hogar;SegurCaixa

Cliente con error de acceso a Línea Abierta no podemos atender su petición;LineaAbierta

Por dónde puedo resolver una transferencia internacional recibida en incidencias;TransferenciasAlExtranjero

Por dónde puede ingresar un vendedor de la SELAE la recaudación de la lotería de Navidad;RecaudacionYOtrasOperaciones

Quiero cerrar sesión de la tablet;It

Cómo se activa el TAP Visa Contactless;Tarjetas

Requisitos que debe tener una primera hipoteca para que sea también una segunda hipoteca;ProductosDeActivo

Como dar de altabaja una senal en fondos de inversion;FondosDeInversion

Cómo puedo generar el CMOF;PrestamosYCoberturas

Cómo solicito las cartas de garantía de EPSV garantizados migrados;PlanesDePensiones

Acceder a una videoconferencia programada con mi cliente;HerramientasDeGestionYComerciales

Qué hago para cancelar un Cyberpac;Comercios

valija electronica para loteria;RecaudacionYOtrasOperaciones

Cómo puedo cambiar los datos de una transferencia periódica;liniaObertaWSLOE

Beneficios por Acogida familiar;RecursosHumanos

Cómo se solicitan las vacaciones al Manager;RecursosHumanos

Información de la bonificación anual de la cuota de las tarjetas Repsol más;Tarjetas

de que manera se tramita una alerta de blanqueo;Valores

Tengo que modificar mi contraseña de acceso a Línea Abierta;liniaObertaWSLOE

Cómo puedo aumentar el saldo disponible en mi CaixaBankWallet;liniaObertaWSLOE

Cómo procedo si recibo un mail informando de incidencias documentales en una remesa enviada;ProdFinancieros

Aniversarios de los clientes en AVE;HerramientasDeGestionYComerciales

¿Por qué aparece entregado aplicación pendiente un fichero en Línea Abierta?;LineaAbierta

Qué pasos debo seguir para emitir una transferencia con todos los gastos a cargo del ordenante;TransferenciasAlExtranjero

Deseo saber si el tecleo en la captación de nomina cuenta para el reto;HerramientasDeGestionYComerciales

como solicitar la emisiÓn de la moneda de 30 euros;Efectivo

que comisiones se aplican al ingresar un cheque de otra entidad;ChequesYOid

Trámites para el alta de un expediente de dación en pago;ProductosDeActivo

Necesito información del Carnet Jove;liniaObertaWSLOE

No sé como localizar la información de pago con tarjeta en el cyberpac;Comercios

Se puede pedir la tarifa TPV Bonificado Taxi Contactless;Comercios

Nos olvidamos de teclear dentro de plazo un documento de la Seguridad Social que nos dejó el cliente;RecaudacionYOtrasOperaciones

Cuáles son los errores más comunes en Alfabético que impiden la contratación de un producto de seguros o planes de pensiones;Alfabetico

Por donde puedo consultar las remesas de efectivo de la oficina;Efectivo

Cómo cambio los datos de una transferencia internacional periódica;liniaObertaWSLOE

Cómo hago para que una transferencia internacional sea habitual;TransferenciasAlExtranjero

¿se han de guardar las boletas del tpv?;Comercios

Puedo consultar el estado del cuestionario medico en un plena;SegurCaixa

En que horario puedo abrir el reciclador en oficinas con TOR;DispensadoresYRecicladores

Quiero solicitar la despignoración de un vida ahorro de BdV Cómo lo hago;Seguros

Cómo consulto el NRC de un pago que he hecho a la agencia triburaria;liniaObertaWSLOE

Cómo sé las diferencias entre el hogar completo y el premium;SegurCaixa

Diferentes formas de retener un producto de pasivo como garantía;ProductosDeActivo

Quiero recuperar mis clientes EAP después de la baja;HerramientasDeGestionYComerciales

Cómo hago para dar de baja a un usuario de LO;LineaAbierta

Articulo no entregado en compra estrella;Marketing

Qué debo hacer para cobrar las aportaciones impagadas de un PJE;Seguros

Se pueden modificar las transmisiones de TIR para que vaya todo por Línea Abierta;DomiciliacionesTransferenciasPagos

Puedo dar de alta un comercio que está fuera de España;Comercios

Dónde se encuentra la aceptación de tarjetas MasterCard Wholesale Travel en comercios;Comercios

Tengo dudas en la novación de un crédito y sus bonificaciones;ServiciosJuridicos

Por dónde consulto qué son las campañas de tarjetas;Tarjetas

Cómo consulto un pago a terceros;liniaObertaWSLOE

Tengo una solicitud de traspaso cómo puedo modificarla;HerramientasDeGestionYComerciales

La instalación del detector tiene dto;SegurCaixa

Cómo repercute la bonificación de siniestralidad en las pólizas de hogar;SegurCaixa

Por dónde se consultan los comunicados de las cuentas canceladas en Línea Abierta;LineaAbierta

Necesito saber cuándo abre la oficina;liniaObertaWSLOE

Por qué se pone un Bloqueo Cautelar de tarjeta por Incumplimiento de la ley 10/2010;Tarjetas

Qué países requieren autorización centralizada;Alfabetico

Tengo que anular el cobro de un modelo de Hacienda tramitado por LO;MinisterioDeHacienda

¿Si una cuenta es mancomunada cómo se resuelven instrucciones contradictorias de los titulares?;ServiciosJuridicos

Es posible cambiar el escáner de sitio;It

Necesito que se anule una factura de compra hecha por importe incorrecto puedo por oficina;Comercios

Cómo puedo solicitar una cancelación registral de una Condición Resolutoria;PrestamosYCoberturas

De qué forma se pueden descargar las devoluciones de TIR en fichero desde Línea Abierta;LineaAbierta

Necesito pedir un nuevo terminal fijo con una extensión nueva;Telefonia

Cómo podemos ingresar un pagaré que se ha devuelto parcialmente;ChequesYOid

Quiero que mi cliente pueda presentar los recibos por Línea Abierta Cómo lo vinculo;DomiciliacionesTransferenciasPagos

Cómo resolver una transferencia en incidencias afectada por la OFAC;TransferenciasAlExtranjero

Si la revisión del contrato con IRPH Cajas es posterior al 1 de noviembre qué tipo de interés aplicará;ProductosDeActivo

Qué tengo que hacer para declarar la dependencia en una Renta Vitalicia;Seguros

No sé en qué afecta la diferencia de titularidad de la cuenta de abono y del comercio;Comercios

Se puede sacar el cuadro de amortización pasado de un crédito abierto;PrestamosYCoberturas

¿Dónde puedo acceder para realizar un cambio de idioma en mi Smartphone?;Telefonia

Condiciones de proveedor en un sia de confirming;ProdFinancieros

Características de la Bein sport;SegurCaixa

¿Puede un representante legal ver las cuentas del incapacitado en Línea Abierta?;LineaAbierta

Todos los recibos se pueden financiar con una tarjeta de crédito;DomiciliacionesTransferenciasPagos

Qué operativa debe seguir el cliente en Línea Abierta para tener un duplicado de certificado fiscal de empresa;LineaAbierta

Tengo en incidencias un recibo por exceso de traspasos Cómo se resuelve;DomiciliacionesTransferenciasPagos

Qué hay que hacer para contratar el servicio de Cerg Finance;LineaAbierta

En qué momento se le carga a mi cliente el importe de la penalización en la campaña Family;Marketing

Qué son las transferencias favoritas;liniaObertaWSLOE

Se puede dar de alta una hipoteca inversa;CreditoLeasingRentingRiesgo

Es posible consultar los listados no gestionables;HerramientasDeGestionYComerciales

Sabemos qué caducidad tienen los cheques;ChequesYOid

Cual es la operativa de consulta de norma de pagares caixa;Ahorro

Dónde consultar el cambio en divisas para operaciones de exportación;Extranjero

Quiero saber cómo se pueden consultar las facturas del servicio DevoluIva;Tarjetas

Cómo emitir un Certificado de Titularidad de una cuenta de nuestra entidad mediante un mensaje SWIFT;TransferenciasAlExtranjero

Cómo consultar un cheque o pagaré cargado al cliente;ChequesYOid

Cómo puedo realizar el pago de participaciones de Lotería Nacional premiadas depositadas en otras entidades;RecaudacionYOtrasOperaciones

Cómo se pueden consultar las devoluciones de recibos domiciliados en Línea Abierta;LineaAbierta

Cómo indico que un comercio tenga permitido aceptar tarjetas American Express;Comercios

Cómo debo proceder para resolver la incidencia de una factura;ArchivoMttoYSuministros

Dónde puedo ver qué emisoras de modelos truncados de Seguridad Social aceptamos a trámite;RecaudacionYOtrasOperaciones

¿Cómo es la apertura de cuentas de patrimonios protegidos?;ServiciosJuridicos

La foto carnet del cliente cómo se da de baja;Tarjetas

Asesor de Ventas consultar los listados;HerramientasDeGestionYComerciales

Que pasos seguir para dar de alta un pacto de comisiones en remesas electrónicas de exportación;Extranjero

Quiero hacer el alta de un cliente pero no tiene su documento identificativo;Alfabetico

Qué tengo que hacer si el cliente ha perdido la libreta;Ahorro

Por qué no se ha cobrado el recibo del préstamo si factura el día 1;RecursosHumanos

Características y Coberturas de SegurCaixa Camiones;SegurCaixa

Que hacer para convertir el interés nominal en TAE;Ahorro

Cómo accedo para consultar las distintas operativas para cada producto procedentes de Caja Burgos;Seguros

Cómo puede un cliente realizar un ingreso a empresa desde el cajero;Cajeros

necesito localizar el CCV de un valor externo que el cliente quiere traspasar;Valores

Cómo puedo consultar las diferencias imputadas de caja de la oficina;ArqueoYContabilidad

Dónde accedo para pedir un anticipo de la nómina;liniaObertaWSLOE

Qué hago para retroceder una operación con una tarjeta perdida;Tarjetas

Quiero saber las propiedades de las tarjetas regalo multiProtección;TarjetasDePrepago

Qué he de hacer para asegurar a una persona que está viviendo fuera de España;SegurCaixa

Cómo puedo poner un teléfono específico solo para firmar operaciones de Línea Abierta;LineaAbierta

Puedo descarterizar a un cliente de la cartera de negocios;HerramientasDeGestionYComerciales

Se pueden realizar obras en un inmueble alquilado a BuildingCenter;Buildingcenter

Cómo sé cuándo debo pasar la MiFID;Valores

No me deja poner un apartado de correos a un cliente;Alfabetico

Cuánto se demora el abono en una remesa electrónica de exportación;Extranjero

Puedo añadir un cotitular a la tercera cuenta de empleado;RecursosHumanos

como declarar un siniestro de coche;SegurCaixa

tarjetas de crédito liquidación;Tarjetas

Por donde debo autorizar un descubierto en cuenta;ProductosDeActivo

Cómo puedo dar de baja los servicios de Bolsa Abierta desde Línea Abierta;LineaAbierta

Información sobre el listado TOCL0017;ArqueoYContabilidad

Cómo puedes modificar las claves de acceso a Línea Abierta;liniaObertaWSLOE

Cómo gestiono la incompatibilidad de señales con la 310;ProductosDeActivo

Por donde puedo consultar el próximo día de recomendación de efectivo;Efectivo

Por error pasé un modelo de hacienda por menos importe del que era;MinisterioDeHacienda

