Qué tipo de clientes pueden pedir una tarjeta regalo;liniaObertaWSLOE

¿Cómo dar de alta un concentrador?;Comercios

El descuento que se ha cobrado no corresponde con el pactado;Comercios

como puedo consultar los tipos de interes de las emisiones de Renta Fija;Valores

Cuáles son los titulares que se declaran en CIRBE;ProductosDeActivo

Requisitos para solicitar talonarios de cheque gasóleo bonificado;ChequesYOid

Cómo puedo realizar la baja de la orden periódica de una transferencia mensual;liniaObertaWSLOE

cobro de loteria de catalunya;RecaudacionYOtrasOperaciones

Tengo dudas legales y no sé cómo contactar con el equipo de letrados;ServiciosJuridicos

Quiero saber los tipos servicios de alertas al móvil;Tarjetas

A qué entidades no se les aplica la retención;Valores

Cómo buscar un delimitador de descuento ocasional;CreditoLeasingRentingRiesgo

¿Se puede devolver un pago domiciliado de la seguridad social?;RecaudacionYOtrasOperaciones

Que tengo que hacer para eliminar el aviso cliente es interlocutor o miembro de un grupo en el traspaso de clientes;HerramientasDeGestionYComerciales

Hay forma de reactivar el PIN EMV de una tarjeta;Tarjetas

Cuál es el procedimiento a seguir para anular un servicio de efectivo recomendado;Efectivo

Como localizar un reintegro con billetes no dispensados en los movimientos del cajero;Cajeros

Condiciones del Auto negocio plurianual;SegurCaixa

Hay algún requisito para reclamar cargos que me han hecho en mis tarjetas y no me han ofrecido el servicio;liniaObertaWSLOE

Quiero consultar una Orden de Traspaso Efectivo emitida Dónde la puede localizar;DomiciliacionesTransferenciasPagos

Cómo tramito el alta de un pacto por cliente;HerramientasDeGestionYComerciales

Necesito información del sistema de compra por Internet Paypal;Tarjetas

Por dónde informo la siniestralidad de camiones en una simulación;SegurCaixa

Cómo actuar si tengo un error por incumplimiento al no tener el documento de identificación digitalizado;Alfabetico

cómo resuelvo un sobrante de provisión que tengo en el cop?;ArqueoYContabilidad

Se puede realizar desvío de llamadas desde cualquier modelo de teléfono fijo;Telefonia

Confirming de grupo de clientes oferta;ProdFinancieros

Cómo se gestiona la oferta vinculante en una subrogación entre entidades;PrestamosYCoberturas

Necesito cambiar el idioma de un correo de Outlook;It

Cuándo el ingreso de un pagaré genera una remesa al realizar el ingreso;ChequesYOid

Imprimir instrucciones pendientes de un crédito de importación;Extranjero

Hasta cuándo se puede modificar un efecto de cartera;FinanciacionEspecializada

Como anulamos un traspaso de un fondo de inversion;FondosDeInversion

Como localizo el seguimiento de las campañas comerciales en el AVE;HerramientasDeGestionYComerciales

Cómo cambio una imagen privada para que sea una imagen pública;Tarjetas

Cliente solicita claves de acceso para Línea Abierta;LineaAbierta

Quiero anular una transferencia a otra cuenta de CaixaBank;liniaObertaWSLOE

Como realizar una simulacion fiscal en Carteras de Fondos;FondosDeInversion

Si una persona es declarada por Caixabank en la CIRBE Por dónde lo consulto;ProductosDeActivo

quiero reasignar personas entre negocios o carteras;HerramientasDeGestionYComerciales

De qué manera pagar un impuesto en el cajero si no funciona el lector de código de barras;Cajeros

Cómo cambio el teléfono móvil principal si tengo acceso a mi antiguo número de teléfono;liniaObertaWSLOE

Ruta para sacar certificado cancelación deuda de un préstamo;PrestamosYCoberturas

Quiero reiniciar el SmartPC;It

Cómo se realiza la baja de un contrato de ordenante de pagos masivos;DomiciliacionesTransferenciasPagos

Qué seguros constan en el certificado de seguros en caso de fallecimiento de un cliente;SegurCaixa

Se puede dar de alta a un cliente para que sea presentador de recibos de TIR;DomiciliacionesTransferenciasPagos

Dónde hay información sobre el Previsión Profesional antiguo;SegurCaixa

Por dónde podemos enviar a validar un fichero de cuaderno XML desde la oficina;DomiciliacionesTransferenciasPagos

Se puede gestionar un expediente electrónico de tarjetas;Tarjetas

Qué tipo se aplica a préstamos con IRPH Cajas que revisan con la publicación posterior al 1 de noviembre;ProductosDeActivo

Dónde puedo anular una reserva de billetes extranjeros;Extranjero

¿Que es la conexión NFC y pagos?;Telefonia

De qué manera consulto los puntos de mantenimiento de la tarifa Plana Negocios Bonificada;Comercios

Puedes utilizar tu tarjeta de CaixaBank en el extranjero;liniaObertaWSLOE

Permiso de hasta 20 horas anuales;RecursosHumanos

De qué manera consulto las funcionalidades del servicio CaixaBankFactura;LineaAbierta

Puedo conectar el SMARTPC a WIFI públicas;It

unidad de ingresos automáticos del cajero quiero resolver un problema;Cajeros

Un tutor nos pide documentación porque ha fallecido el incapacitado legal;ServiciosJuridicos

Dónde puedo ver un listado de los impuestos que he pagado;liniaObertaWSLOE

Quiero hacerme cliente de CaixaBank por Internet;liniaObertaWSLOE

Afectación por los nuevos niveles modificados y creados XIVXIII y XII;RecursosHumanos

Qué hago si detecto un error de comunicaciones o un error al acceder a la configuración del reciclador;DispensadoresYRecicladores

Cómo se da de baja el seguro de saldo pendiente;Tarjetas

Descripción de recibo único;liniaObertaWSLOE

Documentación que debo presentar en la empresa para tramitar la Adopción;RecursosHumanos

Quiero configurar la conexión a internet de mi smartphone;Telefonia

En qué consiste la Multiadquirencia;Comercios

Dónde hay información sobre la fiscalidad de la PVI;Seguros

Desconozco como consultar el numero de servicios de efectivo que tiene autorizados la oficina;Efectivo

Necesito saber dónde entrar para declarar el impuesto 347;liniaObertaWSLOE

Cuál es la dirección para acceder a la extranet;It

Cómo consultar las condiciones de la Tarifa Clientes Comandia;Comercios

Hay información para consultar la solicitud de instalación de un TPV;Comercios

Cómo puede realizar un cliente la designación de beneficiarios de un plan de pensiones por Línea Abierta;LineaAbierta

Qué tengo que hacer para anular una reserva de moneda extranjeros;Extranjero

Cuánto tiempo se guardan los listados trimestrales;It

Cómo puedo sacar un certificado de la posición;Valores

Cómo pasar de residente a no residente;Alfabetico

Qué importe máximo se puede donar en OSD;ArchivoMttoYSuministros

Cuál es el procedimiento para anular un pagaré ingresado en el día por la oficina;ChequesYOid

¿Puedo incluir en mi póliza salud a mi suegra?;RecursosHumanos

quiero el resguardo provisional de movimientos de valores;Valores

Cómo puedo ceder billetes extranjeros por transporte de fondos;Efectivo

Cómo se tramita la oferta vinculante en una subrogación entre entidades;PrestamosYCoberturas

Cómo hago un pack multiseguros;SegurCaixa

Qué hago con las llaves que me trae el inquilino de un inmueble de BuildingCenter;Buildingcenter

Cómo dar de baja una orden de reinversión de dividendos de valores internacionales;Valores

Necesito solicitar un cargador para el TPV GPRS;Comercios

Cuándo se tramita un siniestro de un seguro de Accidente;SegurCaixa

Cómo consultamos el motivo por el que han devuelto una OTF;DomiciliacionesTransferenciasPagos

No se cómo puedo consultar la liquidación de una transferencia internacional recibida;TransferenciasAlExtranjero

En qué momento se carga un efecto reclamado de un cedente;FinanciacionEspecializada

Quiero modificar la clave de acceso a Línea Abierta;liniaObertaWSLOE

traspasos de valores estados;Valores

Puedo contrata un trsf a un vh de segunda mano;SegurCaixa

A quién va dirigido el servicio DevoluIVA;Tarjetas

Cómo puedo dar de alta una nueva solicitud de bastanteo de poderes;ServiciosJuridicos

Hay forma de saber los requisitos para comprar con el móvil;Tarjetas

Qué hago con un efecto que no ha salido  con la remesa que ya se ha enviado por valija;FinanciacionEspecializada

Cómo se puede realizar una transferencia a otra entidad;DomiciliacionesTransferenciasPagos

Tengo en listados de oficina TOCL0017 por totalización;ArqueoYContabilidad

Consulta sobre la gestión de comisiones de cheques y pagarés;ChequesYOid

¿cómo puedo llamar a Asnef?;ProductosDeActivo

Se puede negar un contrato de tarjetas;Tarjetas

Cuáles son los requisitos para beneficiarme de una Cuenta Family;liniaObertaWSLOE

Cómo simulo un auto;SegurCaixa

Qué cubre el seguro de accidentes completo;SegurCaixa

Qué hago para teclear una imposición de ahorro a plazo;Ahorro

puk para desbloquear el movil;Telefonia

Servicio de ayuda al cliente de Línea Abierta;LineaAbierta

Por donde consulto las condiciones campaña Futbol beIN;Marketing

Como puedo configurar un SMARTPC si cambio de oficina;It

Necesito saber como se agrupan las diferentes operativas en los límites de una Línea Abierta;LineaAbierta

Cuál es el procedimiento para financiar un recibo cargado con una tarjeta de crédito;DomiciliacionesTransferenciasPagos

Necesito información para el cambio de un número de móvil de un cliente en el contrato de alertas de particulares;LineaAbierta

Cómo cambiar el importe de una aportación periódica;Ahorro

Puedo abrir un adjunto archivado por OWA;It

Dónde miro la posición de todos mis productos;liniaObertaWSLOE

Necesito ver cuáles son los últimos recibos que he pagado;liniaObertaWSLOE

Quiero ver un pagaré que he emitido;liniaObertaWSLOE

Dónde se consultan los servidos de efectivo que tiene autorizados la oficina;Efectivo

Uso de la biometría tras realizar una restauración de contraseña de la estación de trabajo;It

Donde modifico la periodicidad de los extractos de ahorro vista;Ahorro

Cómo dar de alta la ayuda de la emancipación;DomiciliacionesTransferenciasPagos

Me han saltado hoy domiciliaciones erróneas de hacienda cómo las puedo resolver;MinisterioDeHacienda

Por dónde veo qué tarjetas hay de Accionista CaixaBank;Tarjetas

Por qué no puedo ver el tamaño de la letra más grande;It

Cómo pedir un talonario de la cuenta administrativa de la oficina;ChequesYOid

Deseo consultar la comisión por ingreso de billetes en una cuenta en divisas;Extranjero

Cómo se hace un cambio de domiciliación de un leasing;CreditoLeasingRentingRiesgo

Necesito consultar el histórico de prestaciones de desempleo abonados a un cliente;RecaudacionYOtrasOperaciones

Se puede modificar el depósito vinculado a un préstamo;PrestamosYCoberturas

No sé cómo volver a dar de alta un pensionista que está dado de baja;RecaudacionYOtrasOperaciones

Operativa para personas con deficiencias visuales en cajeros;Cajeros

No sé cómo recuperar el IVA por un comprador con el servicio Taxfree;Comercios

Si he registrado mi huella tengo que acceder siempre al terminal con la huella;It

Quiero modificar mi teléfono móvil principal cómo hago para no recibir el código de seguridad a ese mismo número que quiero cambiar;liniaObertaWSLOE

Cómo cancelar los datos de un cliente;Alfabetico

Que hay que hacer para segregar un expediente de valores;Valores

Cuál es la descripción de cuenta de confianza;liniaObertaWSLOE

De qué forma puedo localizar la información del servicio Taxfree;Comercios

Incluir dinero en el saldo de la cybertarjeta tiene coste;TarjetasDePrepago

anulacion pago recibo servicaixa;Cajeros

Tengo un cliente que necesita sacar duplicados de comunicados fiscales;LineaAbierta

Dónde puedo consultar los saldos de mis tarjetas;liniaObertaWSLOE

donde puedo consultar la información de derivados;Valores

Puedo consultar la liquidación de una transferencia internacional abonada;TransferenciasAlExtranjero

Qué tengo que hacer para aperturar una libreta MicroBank;Ahorro

Cliente se ha dado de alta por internet y ha domiciliado la nómina;LineaAbierta

Cuáles son los tipos de envío que puede tener un cliente en la Correspondencia Personalizada;ArchivoMttoYSuministros

Cómo hago para que el cajero muestre en menú inicial las operaciones habituales;Cajeros

Por dónde se descarga el cliente el fichero de las devoluciones de TIR;LineaAbierta

Qué hacer si he recibido un mail informando de incidencias documentales en una remesa enviada;ProdFinancieros

Tengo que modificar los parámetros operativos de una libreta a la vista;Ahorro

El cliente no está contacto con la gestión del API podemos solicitar cambio;Buildingcenter

Cuánto vale tener la CaixaBankWallet;liniaObertaWSLOE

A un beneficiario se le pueden dar tarjetas Stock;Tarjetas

Cómo gestionar el ingreso de un pagaré sin captura inmediata;ChequesYOid

Necesito reasignar unas carteras entre empleados;HerramientasDeGestionYComerciales

PPA CABK Tranquilidad 1%  exclusivo para traspasos externos;PlanesDePensiones

Dónde debo dirigirme para solicitar una revisión médica;RecursosHumanos

Tienen descuento los clientes de Imagin Bank en el alquiler de inmuebles de BuildingCenter;Buildingcenter

Cómo puedo obtener un comunicado fiscal por el cobro de un premio de Lotería Nacional;RecaudacionYOtrasOperaciones

Cómo puedo hacer el cobro el canon del Carnet Joven no financiero de la Comunidad de Madrid;Tarjetas

Cuándo se genera remesa al hacer el ingreso de un cheque;ChequesYOid

Con quién debe contactar un inquilino de BC para solicitar permiso de obras;Buildingcenter

Cómo puedo obtener la modalidad operativa de Línea Abierta;liniaObertaWSLOE

Visualizar el estado de un pedido;ArchivoMttoYSuministros

Operativa para cancelar una póliza de Accidentes Telemarketing;SegurCaixa

Cómo puedo consumir los incentivos generados por la venta de inmuebles de BuildingCenter anteriores al 2017;Buildingcenter

Quiero pactar una cuota según la facturación de la tarjeta;Tarjetas

Qué se hace con el material que ha sobrado de la campaña de la leche;ArchivoMttoYSuministros

Cómo puedo pagar la Lotería de la Generalitat de Cataluña;RecaudacionYOtrasOperaciones

Cómo se solicita el envío de extractos mediante un MT940;Extranjero

Creemos que nos han hecho mal el reparto de un expediente de testamentaría;ServiciosJuridicos

Dónde creo una cuenta para ahorrar el cambio;liniaObertaWSLOE

Cómo se tramitan los gastos de empleados;ArchivoMttoYSuministros

Puedo pagar parcialmente un cheque que tengo en incidencias;ChequesYOid

Qué hago si tengo una entrega de recibos en incidencias por superar el límite mensual;DomiciliacionesTransferenciasPagos

Me he equivocado al cobrar un billete del IMSERSO y lo quiero anular;DomiciliacionesTransferenciasPagos

como puedo cancelar un ccs;Marketing

Qué comisiones tiene la compra de un traveller cheque;Extranjero

Tengo que dar de alta una incidencia en compra estrella pero no tengo informada la fecha de entrega;Marketing

Cómo funciona el envío de embargos por el cuaderno 63;RecaudacionYOtrasOperaciones

¿Cómo puedo proceder ante los avisos RUI FATCA CRS?;Alfabetico

Indicaciones para dar de baja una solicitud de prórroga de una financiación de comercio exterior de días anteriores;Extranjero

Por dónde añado a un usuario en una Línea Abierta;LineaAbierta

Por qué opción de Línea Abierta se modifican los datos personales;LineaAbierta

se pueden saber los motivos de la no realización en mercado  de una orden sobre  renta variable;Valores

Si me han robado la tarjeta de Línea Abierta dónde debo dirigirme;liniaObertaWSLOE

Qué documentación se presenta para solicitar la desvinculación incentivada;RecursosHumanos

Por qué  ha quedado retenido el importe de una garantía en el COP  de la oficina;ProductosDeActivo

cómo puedo anular un contrato de ahorro a la vista;Ahorro

No se que hacer en caso de que no pueda activar la alarma;ArchivoMttoYSuministros

Cómo hago la devolución de una transferencia que me han enviado;liniaObertaWSLOE

Qué debo hacer para ver las ofertas para empleados del Grupo La Caixa;Marketing

Cómo puedo dar de alta una remesa de importación;Extranjero

Porque no puedo contratar poliza de auto plurianual?;SegurCaixa

Se pueden saber los mínimos al devolver una cuota de tarjeta;Tarjetas

Operativa de alta de servicuentas;Ahorro

prestamo hipotecarios para empleados de la caixa;RecursosHumanos

Consultar el vencimiento del riesgo de un efecto de cartera;FinanciacionEspecializada

Un cyberpac puede cambiar sus datos y forma de venta;Comercios

como sacar dinero del cajero con un numero secreto;LineaAbierta

Necesito reclamar una operación pendiente de confirmar y no puedo;Tarjetas

Por dónde puedo modificar los titulares de una hipoteca por compraventa;PrestamosYCoberturas

Cómo devolver la comisión de mantenimiento de una cuenta en divisas;Extranjero

Cómo puedo dar de alta un nombre comercial;Alfabetico

Modalidad de la P2000;Seguros

Tienen coste los mensajes push;LineaAbierta

Qué debemos hacer si hemos recibido un mail de no recepción de documentación por valija electrónica de un pago de premio de lotería nacional;RecaudacionYOtrasOperaciones

Por dónde puedo consultar el motivo de rechazo de unos recibos enviados en cuaderno 19 anticipado;FinanciacionEspecializada

Cuándo se da de baja la señal 213 por empresa en constitución si ya se ha constituido la empresa;Alfabetico

Cómo informar el dato específico en una tasa del Principado de Asturias;RecaudacionYOtrasOperaciones

Se puede volver a activar un ordenante de recibos TIR que ahora esta cancelado;DomiciliacionesTransferenciasPagos

Hay dos personas con el mismo DNI en alfabético;Alfabetico

Cuántos números del pasaporte hay que poner en alfabético;Alfabetico

Cuándo me notifican que el alta de un entorno ya está disponible;It

orden de suscripcion de acciones de dividendos de renta variable nacional;Valores

Cómo puedes devolver una transferencia recibida;liniaObertaWSLOE

Es posible modificar mi dirección de correo electrónico;It

Quiero acceder a IGC Cómo lo hago;HerramientasDeGestionYComerciales

Tengo problemas al introducir un teléfono como móvil principal;Alfabetico

Necesito anular una operación del diario electrónico;It

Puedo pedir una nueva estampación de una tarjeta;Tarjetas

Qué debo hacer para informar de un siniestro en una póliza de comunidades;SegurCaixa

Está el Antiguo Programa Auxiliar preparado para confeccionar ficheros con la nueva normativa de SEPA;LineaAbierta

Qué hacer con un TIR pendiente por excedido de límites;DomiciliacionesTransferenciasPagos

Dónde entro para declarar un siniestro de un decesos;SegurCaixa

Cuál es la operativa para anular las notificaciones de ReciBox;LineaAbierta

Por dónde puedo ver las incidencias de los efectos de cartera de días anteriores;FinanciacionEspecializada

Puedo anular una devolución de compra realizada erróneamente;Comercios

Cómo funciona el adhesivo del móvil para Contactless;liniaObertaWSLOE

Quiero ponerme en contacto con Atencion al cliente;liniaObertaWSLOE

Por dónde modifico un contrato para que no se queden pendientes todas las remesas de TIR;DomiciliacionesTransferenciasPagos

Tengo una señal 213 por poderes caducados o incompletos;ServiciosJuridicos

Qué es una financiación de importación;Extranjero

Qué relaciones contractuales se permiten en los avales;ProductosDeActivo

Operativa para declarar un siniestro de una Renta Vitalicia;Seguros

A qué hace referencia el código Banco Destino;liniaObertaWSLOE

Las oficinas tienen el mismo horario durante todo el año;liniaObertaWSLOE

Modificación Tipo de Interés: Formalización;ServiciosJuridicos

Cómo se marca un cheque para que no se cobre comisión al ingresarlo;ChequesYOid

Dónde encuentro la información que he solicitado por el Histórico de operaciones;It

Cómo se puede descargar en Línea Abierta un fichero de comunicados agrupados;LineaAbierta

Por dónde se pueden modificar los conceptos de una facturación de recibos TIR;DomiciliacionesTransferenciasPagos

Cómo puedo hacer la carga de efectivo en el reciclador;DispensadoresYRecicladores

Tengo un alta de negocio  a qué oficina cuenta;HerramientasDeGestionYComerciales

Dónde desactivo los mensajes de CaixaBankProtect;liniaObertaWSLOE

No estoy seguro por dónde cobrar un impuesto de transmisiones patrimoniales;RecaudacionYOtrasOperaciones

Quiero contratar un nuevo producto a un cliente y me indica que el NIF está duplicado;Alfabetico

Detalles de los Planes de Pensiones procedentes de BdV;Seguros

Cómo efectuar el alta de la familia de descuento de pagarés STR en una línea de riesgos comerciales;CreditoLeasingRentingRiesgo

Cómo acepto el dictamen de un expediente de defunción;Alfabetico

No sé solicitar un traspaso interno en una EPSV;PlanesDePensiones

Cómo puedo ver si a un cliente se le repercuten los gastos de correo;ArchivoMttoYSuministros

Tengo que pedir que cambien el escáner de sitio;It

Todo lo que necesito saber sobre las bajas de servicuentas;Ahorro

Tiene repercusion si el importe supera los 10000 del fraude hecho a una tarjeta;Tarjetas

La tarjeta regalo permite reintegros de efectivo en cajeros;TarjetasDePrepago

Propiedades del SegurCaixa negocio;SegurCaixa

Samsung S8 por operaciones para planes y ahorro por línea Abierta y R2B;PlanesDePensiones

En qué consiste el SegurCaixa industria;SegurCaixa

Por qué la luz lateral del reciclador no se apaga;DispensadoresYRecicladores

Cómo se da de alta la ayuda del alquiler para jóvenes;DomiciliacionesTransferenciasPagos

Estoy intentando solicitar la retrocesión de un traspaso entre cuentas propias y no me deja;DomiciliacionesTransferenciasPagos

Puedo ver todos los poderes que tiene un apoderado según la empresa;ServiciosJuridicos

Cómo puedo consultar las cotizaciones;Valores

Cómo puedes pagar a plazos los próximos recibos domiciliados;liniaObertaWSLOE

Tengo una tarjeta SIM para portátil;It

Cuál es la operativa para anular una financiación de comercio exterior que he realizado hoy;Extranjero

Cuál es la ayuda que se recibe por defunción de un familiar;RecursosHumanos

Características de las ofertas de los microcréditos sociales;PrestamosYCoberturas

Hay un límite de importe para hacer un avance de pago;liniaObertaWSLOE

Como se hace un ingreso en una cuenta de ahorro vista propia;Ahorro

El balance de empresa Cuándo caduca;ProdFinancieros

Cómo puedo completar una captura que ha quedado sin finalizar;ChequesYOid

En que casos se puede cambiar una libreta a plazo;Ahorro

como se entran los tickets;ArchivoMttoYSuministros

Cuál es la operativa para solicitar una sustitución de una tarjeta;Tarjetas

Dónde hay información sobre el seguro gratuito de Expoliación a comercios;SegurCaixa

Cómo hago para que los usuarios de una reunión de Lync vean mi escritorio;It

Cómo se las condiciones del TPV Tablet;Comercios

Configuración de la automatización de ingresos de cajero;ArqueoYContabilidad

Existe algún control de la concentración de riesgo en el ingreso de cheques en una cuenta;ChequesYOid

Cuándo se genera y cómo funciona el servicio de apertura de descubierto;ProductosDeActivo

Quiero saber si la tarjeta tiene activado el servicio Priority Pass;Tarjetas

Hasta que hora puedo ceder efectivo;Efectivo

Desconozco el motivo por el cual el cliente no recibe correspondencia;ArchivoMttoYSuministros

que tipos de pias flexibles hay?;Seguros

Cómo proceder para anular un adeudo de dentro de una remesa de TIR;DomiciliacionesTransferenciasPagos

Cómo se tiene que volver a escanear el documento firmado para la Obra Social Descentralizada;ArchivoMttoYSuministros

Información sobre como iniciar una Operación Interbancaria;ChequesYOid

Cómo se consulta en Línea Abierta la liquidación de las devoluciones de Q19;LineaAbierta

Qué hago si cambio de modelo de un articulo de compra estrella y el préstamo está constituido;Marketing

2% de abono en efectivo al contratar un SegurFon Caixa Carteras 9;Seguros

como reactivar un contrato de tarjetas;Tarjetas

Cómo cambio las claves de acceso a Línea Abierta;liniaObertaWSLOE

Por qué hay una señal 214 por política interna de PBC;Alfabetico

Cómo proceder ante una devolución de un recibo SEPA recibida de otra entidad fuera de plazo;DomiciliacionesTransferenciasPagos

Cómo puedo dar de alta la Cuenta Family;Ahorro

Puedo digitalizar firmas por el escáner Fujitsu;It

Cuando pudo hacer un desistimiento de un articulo;Marketing

Por donde se anulan las remesas de efectivo;Efectivo

He traído efectivo desde otro banco a CaixaBank y quiero saber en qué situación está;liniaObertaWSLOE

Qué pasos he de seguir para vincular una tasación de finca rústica;ProductosDeActivo

Cómo duplico la póliza de comunidades;SegurCaixa

Un fichero de PAG se ha quedado en incidencias y hay que resolverlo;DomiciliacionesTransferenciasPagos

Por qué la unidad de billetes del cajero está fuera de servicio;Cajeros

En qué establecimientos puedo utilizar la tarjeta de incentivos de BuildingCenter;Buildingcenter

Cómo puedo dar de alta o modificar una referencia de bastanteo;ServiciosJuridicos

Cómo trato un ingreso de cajero que no cumple los requisitos de blanqueo de capital;Cajeros

Quiero pedir que retiren un teléfono fijo;Telefonia

Qué hago si no me funciona el mouse del terminal;It

